{
  "actors": [
    {
      "id": "infra_team_na",
      "name": "Infrastructure Operations Team - North America",
      "type": "human"
    },
    {
      "id": "infra_team_emea",
      "name": "Infrastructure Operations Team - EMEA",
      "type": "human"
    },
    {
      "id": "infra_team_apac",
      "name": "Infrastructure Operations Team - APAC",
      "type": "human"
    },
    {
      "id": "cab",
      "name": "Change Advisory Board",
      "type": "human"
    },
    {
      "id": "service_now",
      "name": "ServiceNow System",
      "type": "system"
    },
    {
      "id": "pager_duty",
      "name": "PagerDuty System",
      "type": "system"
    },
    {
      "id": "zoom",
      "name": "Zoom",
      "type": "human"
    },
    {
      "id": "confluence",
      "name": "Confluence",
      "type": "human"
    }
  ],
  "phases": [
    {
      "id": "request_submission",
      "name": "Change Request Submission"
    },
    {
      "id": "regional_approval",
      "name": "Regional Approval"
    },
    {
      "id": "cab_review",
      "name": "CAB Review"
    },
    {
      "id": "implementation",
      "name": "Implementation"
    },
    {
      "id": "closure",
      "name": "Closure"
    }
  ],
  "tasks": [
    {
      "id": "submit_rfc",
      "name": "Submit Change Request",
      "actor_id": "infra_team_na",
      "phase_id": "request_submission",
      "handoff_to": [
        "infra_team_emea"
      ]
    },
    {
      "id": "regional_approval_na",
      "name": "Regional Approval - North America",
      "actor_id": "infra_team_na",
      "phase_id": "regional_approval",
      "handoff_to": [
        "infra_team_emea"
      ]
    },
    {
      "id": "regional_approval_emea",
      "name": "Regional Approval - EMEA",
      "actor_id": "infra_team_emea",
      "phase_id": "regional_approval",
      "handoff_to": [
        "infra_team_apac"
      ]
    },
    {
      "id": "regional_approval_apac",
      "name": "Regional Approval - APAC",
      "actor_id": "infra_team_apac",
      "phase_id": "regional_approval",
      "handoff_to": [
        "cab"
      ]
    },
    {
      "id": "cab_review_task",
      "name": "CAB Review for Major Changes",
      "actor_id": "cab",
      "phase_id": "cab_review",
      "handoff_to": [
        "infra_team_na"
      ]
    },
    {
      "id": "implement_change",
      "name": "Implementation of Approved Change",
      "actor_id": "infra_team_na",
      "phase_id": "implementation",
      "handoff_to": [
        "infra_team_na"
      ]
    },
    {
      "id": "close_change",
      "name": "Change Closure and Documentation",
      "actor_id": "infra_team_na",
      "phase_id": "closure",
      "handoff_to": [
        "UNKNOWN"
      ]
    }
  ],
  "flows": [
    {
      "id": "flow_1",
      "from": "submit_rfc",
      "to": "close_change"
    }
  ],
  "issues": [
    {
      "id": "issue_1",
      "note": "CAB meeting minutes input delay causes outdated records"
    },
    {
      "id": "issue_2",
      "note": "Mixed notification channels (Teams/Slack) reduce communication efficiency"
    },
    {
      "id": "issue_3",
      "note": "UNKNOWN"
    }
  ],
  "gateways": [
    {
      "id": "risk_assessment_gate",
      "name": "Risk Level Assessment",
      "type": "exclusive"
    },
    {
      "id": "cab_decision_gate",
      "name": "CAB Approval Gate",
      "type": "exclusive"
    }
  ],
  "metadata": {
    "id": "global_it_change_management",
    "title": "Global IT Change Management",
    "source": "ユーザ提供サンプル",
    "last_updated": "2024-04-27",
    "generation": {
      "model": "gpt-4.1-mini",
      "provider": "openai"
    }
  }
}